{
  "proposal_id": "memprop-bit68-memory-stewardship-v1",
  "created_at": "2026-03-10T13:15:00Z",
  "memory_layer": "project",
  "source_artifacts": [
    "linear/temporal/active/project__bootstrap__0727b3f56ccd/stage4-5-agent-stack-execution-plan-v1.md",
    "linear/protocol/agent-references/taylor-orchestrator-contract-v1.md"
  ],
  "target_path": "linear/protocol/agent-references/memory-stewardship-service-contract-v1.md",
  "summary": "Preserve the rule that the memory steward proposes durable writes while Taylor remains the approval gate.",
  "rationale": "This keeps durable knowledge reviewable and prevents silent memory drift across future agent surfaces.",
  "confidence": 0.95,
  "contradiction_status": "clear",
  "approval": {
    "state": "proposed",
    "approver": "Taylor",
    "approved_at": null
  },
  "notes": "Phase 4 baseline only; no automatic memory writes."
}
